{
  "$schema": "../../Runtime/StoryData/schema/story.schema.json",
  "title": "The Last Ride of Isaiah Free",
  "description": "1873, Texas. Isaiah Free — freedman, bounty hunter, survivor — rides into the town of Redrock with one name on his list: Colonel Harlan Vance, the man who sold his family into bondage and kept on living like it was nothing. But Freedmen's Town, the Black settlement Isaiah once called home, is surrounded, and the people who raised him are running out of time.",
  "author": "Minority Narrative Engine Demo",
  "version": "1.0",
  "culturalContext": "black_american",
  "startNodeId": "open_road",

  "nodes": [

    {
      "id": "open_road",
      "type": "narration",
      "text": "The Texas flatlands stretch out like they got no end and no beginning. Dust kicks up behind you all the way from Beaumont. You been riding three days on the scent of one man. The wanted poster is worn soft in your coat pocket — you don't need to look at it no more. You know that face better than your own.",
      "displayDuration": -1,
      "nextNodeId": "open_road_2"
    },

    {
      "id": "open_road_2",
      "type": "narration",
      "text": "1873. Eight years since Emancipation and freedom still got more sharp edges than smooth ones. You ride free. You hunt men for pay. But this one — Colonel Harlan Vance — you'd track to the edge of the earth for free.",
      "nextNodeId": "juniper_encounter"
    },

    {
      "id": "juniper_encounter",
      "type": "dialogue",
      "speakerId": "juniper_roots",
      "text": "You Isaiah Free?",
      "displayDuration": -1,
      "nextNodeId": "isaiah_yes"
    },

    {
      "id": "isaiah_yes",
      "type": "dialogue",
      "speakerId": "isaiah_free",
      "text": "Depends who's asking.",
      "nextNodeId": "juniper_intro"
    },

    {
      "id": "juniper_intro",
      "type": "dialogue",
      "speakerId": "juniper_roots",
      "text": "My name is Juniper Roots. Comanche Nation. I've been watching you ride since Medina Creek. Man riding like that's either being chased or chasing something that won't end well for him.",
      "nextNodeId": "juniper_warning"
    },

    {
      "id": "juniper_warning",
      "type": "dialogue",
      "speakerId": "juniper_roots",
      "text": "Vance left Redrock two nights ago. Burned three buildings in Freedmen's Town on his way out. Said it was a warning. Your people are still there, Isaiah. Ma Ellen and the rest. Vance's men are circling.",
      "culturalTags": ["elder_wisdom"],
      "nextNodeId": "first_choice",
      "triggers": [
        { "type": "set_flag", "key": "heard_freedens_town_danger" }
      ]
    },

    {
      "id": "first_choice",
      "type": "choice_prompt",
      "speakerId": "isaiah_free",
      "text": "The weight of it settles in your chest like a stone. Vance is two days ahead. Freedmen's Town is half a day behind.",
      "collectiveFrame": "both",
      "choices": [
        {
          "text": "Ride for Freedmen's Town. The community comes first.",
          "targetNodeId": "ride_to_community",
          "communityImpact": "Freedmen's Town gets your protection — it may survive.",
          "individualImpact": "Vance gains distance. He may escape justice entirely.",
          "collectivityDelta": 0.8,
          "triggers": [
            { "type": "set_flag", "key": "chose_community_first" },
            { "type": "adjust_community", "key": "freedens_town", "value": 20 }
          ]
        },
        {
          "text": "Ride for Vance. He's what all this has always been about.",
          "targetNodeId": "ride_for_vance",
          "communityImpact": "Freedmen's Town faces Vance's men without you.",
          "individualImpact": "You close the distance on Vance. Justice — or revenge — is in reach.",
          "collectivityDelta": -0.8,
          "triggers": [
            { "type": "set_flag", "key": "chose_vance_first" },
            { "type": "adjust_community", "key": "freedens_town", "value": -15 }
          ]
        },
        {
          "text": "Ask Juniper what she'd do.",
          "targetNodeId": "ask_juniper_advice",
          "communityImpact": "Delay. Every hour costs something.",
          "individualImpact": "You might learn something you didn't know you needed.",
          "collectivityDelta": 0.2
        }
      ]
    },

    {
      "id": "ask_juniper_advice",
      "type": "dialogue",
      "speakerId": "juniper_roots",
      "text": "My people have a saying — a man who chases the wolf that bit him, while his family sleeps in the forest, buries two griefs instead of one.",
      "culturalTags": ["elder_wisdom"],
      "nextNodeId": "juniper_advice_2",
      "triggers": [
        { "type": "adjust_relationship", "key": "isaiah_free", "relatedCharacterId": "juniper_roots", "value": 15 }
      ]
    },

    {
      "id": "juniper_advice_2",
      "type": "dialogue",
      "speakerId": "juniper_roots",
      "text": "But I also know what it is to carry something that won't let you sleep. Both paths are real, Isaiah. Just know: the land remembers what you choose here.",
      "culturalTags": ["land_teaching"],
      "nextNodeId": "first_choice_after_advice"
    },

    {
      "id": "first_choice_after_advice",
      "type": "choice_prompt",
      "speakerId": "isaiah_free",
      "text": "You sit with her words. The sun is getting low.",
      "collectiveFrame": "both",
      "choices": [
        {
          "text": "Ride for Freedmen's Town.",
          "targetNodeId": "ride_to_community",
          "communityImpact": "You go back for your people.",
          "individualImpact": "Vance keeps riding.",
          "collectivityDelta": 0.8,
          "triggers": [
            { "type": "set_flag", "key": "chose_community_first" },
            { "type": "adjust_community", "key": "freedens_town", "value": 20 }
          ]
        },
        {
          "text": "Ride for Vance. You'll come back for them after.",
          "targetNodeId": "ride_for_vance",
          "communityImpact": "You'll come back. You're telling yourself you'll come back.",
          "individualImpact": "Vance is within reach.",
          "collectivityDelta": -0.6,
          "triggers": [
            { "type": "set_flag", "key": "chose_vance_first" },
            { "type": "adjust_community", "key": "freedens_town", "value": -10 }
          ]
        }
      ]
    },

    {
      "id": "ride_to_community",
      "type": "narration",
      "text": "You turn your horse around. Juniper rides beside you without a word. She doesn't need to say it. By nightfall, the torchlight of Freedmen's Town comes into view over the hill — and so do the silhouettes of six men on horseback at the edge of the settlement.",
      "nextNodeId": "maellen_greeting"
    },

    {
      "id": "maellen_greeting",
      "type": "dialogue",
      "speakerId": "ma_ellen",
      "text": "Isaiah Free. Lord have mercy. Boy, I knew you'd come back.",
      "culturalTags": ["testimony"],
      "nextNodeId": "maellen_situation"
    },

    {
      "id": "maellen_situation",
      "type": "dialogue",
      "speakerId": "ma_ellen",
      "text": "Vance's men say they got a deed to this land. Some paper from a county judge who never set foot here. Twenty-three families, Isaiah. This is our home. We built every board of it.",
      "culturalTags": ["testimony"],
      "collectiveFrame": "collective",
      "nextNodeId": "community_choice",
      "triggers": [
        { "type": "set_flag", "key": "heard_deed_threat" }
      ]
    },

    {
      "id": "community_choice",
      "type": "choice_prompt",
      "speakerId": "isaiah_free",
      "text": "You look around at the faces you grew up with. Old Deacon Harris. The Washington children. Sara who teaches school in the church. They're watching you like you got an answer.",
      "collectiveFrame": "collective",
      "choices": [
        {
          "text": "\"We stand our ground. This is your land and I'll die saying so.\"",
          "targetNodeId": "stand_ground",
          "communityImpact": "The community rallies. Risk of violence is high.",
          "individualImpact": "You plant your flag. No turning back.",
          "collectivityDelta": 0.9,
          "triggers": [
            { "type": "set_flag", "key": "chose_stand_ground" },
            { "type": "adjust_community", "key": "freedens_town", "value": 25 },
            { "type": "adjust_relationship", "key": "isaiah_free", "relatedCharacterId": "ma_ellen", "value": 20 }
          ]
        },
        {
          "text": "\"I know where Vance is. I go get him, he can't send more men.\"",
          "targetNodeId": "negotiate_leave",
          "communityImpact": "Leaves the community exposed while you hunt Vance.",
          "individualImpact": "Your personal mission and the community's salvation become the same road.",
          "collectivityDelta": 0.1,
          "triggers": [
            { "type": "set_flag", "key": "chose_hunt_vance_for_community" }
          ]
        },
        {
          "text": "\"We should move. Find somewhere safer. I'll cover the retreat.\"",
          "targetNodeId": "suggest_retreat",
          "communityImpact": "People lose their homes but survive.",
          "individualImpact": "You protect lives. But something is lost that can't be rebuilt.",
          "collectivityDelta": 0.5,
          "triggers": [
            { "type": "adjust_community", "key": "freedens_town", "value": -30 }
          ]
        }
      ]
    },

    {
      "id": "stand_ground",
      "type": "dialogue",
      "speakerId": "ma_ellen",
      "text": "That's what I needed to hear, baby. That is exactly what I needed to hear.",
      "culturalTags": ["call_and_response"],
      "nextNodeId": "stand_ground_2"
    },

    {
      "id": "stand_ground_2",
      "type": "narration",